level_code,grammar_type,category_type,grammar_detail,content,cases
HSK7-9,短语,固定短语,其他（话语标记）,这不,"那些小伙子经常过来帮我在院子里干活，遇着墙坏了就重新垒。这不，院子的东墙就是他们不久前新垒的。
节日到了，我想给他们改善改善伙食。他俩是滕州的，这不，我准备了大葱、煎饼，还有一大盘肉。"
HSK7-9,短语,固定短语,其他（话语标记）,这样一来,"他在屋后的空地上饲养了一群小鸡。这样一来，等小鸡长大后，他就有鸡蛋和鸡肉可吃了。
这些猎犬虽然个个经验丰富、身手矫健，但是对主人却不够信任。这样一来，整个队伍在捕猎时的战斗力并不高。"
HSK7-9,短语,固定短语,其他（话语标记）,退一步说,"向一个根本不喜欢数学的人解释为何迷上数学，这几乎不可能。退一步说，他甚至不能向自己解释清楚。
且不说在近几年内，本省电力紧缺的局面不可能有根本性的改观，退一步说，即使电力紧缺得到基本缓解，小火电仍然有其不可替代之处。"
HSK7-9,短语,固定短语,四字格,七A八B,"司机对这里的道路不太熟悉，竟七拐八绕地把车开到了海边，现在陷在烂泥里出不来了。
乐乐是个十足的捣蛋鬼，常常把家里的玩具拆得七零八落的，用画笔把墙上涂得乱七八糟。"
HSK7-9,短语,固定短语,四字格,不A不B,"我开服装店到今天正好一个月，生意不好不坏。
1000万，对绝大多数人来说是一个天文数字。如果一个人年入10万，他需要不吃不喝100年才能攒够1000万。"
HSK7-9,短语,固定短语,四字格,不A而B,"这名教授在职称晋升后，不顾尚未履行完毕的人事合同，连招呼都不打，直接不辞而别。
有研究表明，长期坚持有氧运动的人心肺功能会得到明显提升，一些疾病也会不治而愈。"
HSK7-9,短语,固定短语,四字格,东A西B,"这几个月我不停地东奔西走，几乎参访了集团下面所有的分公司，足以说明我一直关注集团的发展。
她东拼西凑了3万多元钱，但是离治病所需的高额费用还是远远不够的。"
HSK7-9,短语,固定短语,四字格,半A半B,"我这两天工作压力比较大，晚上一直半睡半醒，第二天精神很差。
他提供的信息半真半假，我们不能完全信任他。"
HSK7-9,短语,固定短语,四字格,可A可B,"小婉对这位天才同事，没有半点嫉妒，而是一开始就由衷地欣赏她，并真心地关爱她，完全像一位可敬可亲大姐姐。
读书笔记要精炼，要根据实际的阅读进度，总结概括，并体现所思所想。篇幅可长可短，决不写空话、假话、应付的话。"
HSK7-9,短语,固定短语,四字格,忽A忽B,"那条盘山公路很险，一个接一个的急转弯。汽车开着像是扭秧歌，忽上忽下，忽左忽右。
羊群在草丛中忽隐忽现。一只细长的牧羊犬忙不迭地穿梭其中。"
HSK7-9,短语,固定短语,四字格,或A或B,"酒吧里的客人手里端着酒杯，或坐或立，姿态各异。
夜深了，可她或躺或坐，一直难以入睡。她生平第一次有这种牵肠挂肚的感觉。
她做的豆腐，或炖或炒，总是色白味醇。乡亲们头一次吃到这么好的豆腐，都夸她手艺好。"
HSK7-9,短语,固定短语,四字格,无A不B,"短短几天，我们就成了无话不谈的好友，一想到就要分开了，不免觉得伤感。
这所无人不知的重点初中的家长可谓卧虎藏龙，基本上都是知名学者、政府高官、企业高管等有着较高社会地位的人。"
HSK7-9,短语,固定短语,四字格,无A可B,"工作地点离城里很远，休息时无处可去，他只得靠钓鱼聊以解闷。
到了淡季，公司业务很少，大部员工无事可做，只能拿底薪。"
HSK7-9,短语,固定短语,四字格,时A时B,"他最近身体时好时坏，但只要他还撑得住，他一定会来参加我们的婚礼的。
雨停了，天上的云渐渐散了，天边有道彩虹时隐时现。"
HSK7-9,短语,固定短语,四字格,爱A不A,"团购的产品价格十分优惠，可商家对待使用团购券的客人却很不热情，总摆出一副爱吃不吃、爱住不住、爱买不买的姿态。
他这个人干什么都我行我素，穿衣打扮更是特立独行，一副“你爱看不看，反正我的事你管不着”的态度。"
HSK7-9,短语,固定短语,四字格,自A自B,"这位导演，早年在外国留过学，编剧功底了得，今天这戏，就是他自编自导的。
他开心极了，直夸我干得好，并自称自赞，说自己眼光独到。"
HSK7-9,短语,固定短语,四字格,连A带B,"一群年轻人连说带笑地迎面走来，整个街道顿时充满了欢声笑语。
昨晚有人在江边骑行，结果连人带车落入江中，至今生死不明。"
HSK7-9,短语,固定短语,四字格,非A非B,"我跟他非亲非故，但是他却为了我的事四处奔波，感动得我不知说什么好。
这些非真非假的传说故事，吊足了一众游客的胃口，也给第二天的行程增添了几分神秘色彩。"
HSK7-9,词类,介词,引出凭借、依据,本着、基于、鉴于1、经、依,"我们本着“友谊第一，比赛第二”的精神，充分享受比赛的乐趣。
虽然我和小孙素日关系更近，但本着实事求是的态度，我还是把票投给了小魏。
基于调研的结果，我们精准定位了产品的目标市场。
这部电影是基于真实事件改编而成的。
鉴于你在此次项目中的突出表现，公司决定对你予以嘉奖。
鉴于市场需求和用户偏好的不断变化，产品设计应适时转变策略，适应市场发展。
决议成文程序严格，须经全体会议或代表大会讨论通过才能生效。
经医生细心诊治，哥哥身体状况日渐好转，已经可以自行下床行走了。
经研究，公司决定把这一重要的新款产品交由你全权负责。
一些无良的鉴定专家不依市场价值而是依主观价值评定东西等级的行为，严重扰乱了市场秩序。
依我看，你在这件事的处理上有失公允。"
HSK7-9,词类,介词,引出对象,当着、就6,"当着这么多人，那人只好把话咽了下去。
大家聊得正高兴，她却当着大家的面掉下泪来。
论坛期间，各国专家就共同感兴趣的专题进行了探讨和交流。
就离婚后的财产分割问题，双方产生了激烈的争论。"
HSK7-9,词类,介词,引出时间、处所,打,"打这天起，小赵替父亲担起了全家的重担。
他悄声说这可是件宝贝，打皇宫里流出来的。"
HSK7-9,词类,代词,人称代词,我,"我校教育质量上乘，办学几十年间为国家培养、输送了大批优秀人才。
我公司始终秉持“以客户为中心”的理念，致力于为客户提供最优质的服务。"
HSK7-9,词类,代词,指示代词,彼、这么着、兹,"“古典小说”鼎盛于明清时期，彼时涌现了如四大名著等众多经典之作。
提起朝阳，人们往往会想到北京的朝阳区。然而我们今日前往参观的此“朝阳”非彼“朝阳”，乃是被誉为“三燕古都”的辽宁省朝阳市。
在商务谈判中，应尽量做到知己知彼，这样才能争取到最大的利益。
你们觉得这么着好就这么办，不必再来问我的意见了。
那地方你人生地不熟的，这么着吧，我陪你一起去看看。
兹证明李莉女士系本单位正式员工，已连续在本单位工作十年。
受有关机构委托，兹有以下标的拟予以转让，现公告如下，欢迎合格投标人参加该项目投标。"
HSK7-9,词类,代词,数量代词,若干,"经过初赛、复赛和决赛，大赛产生了“十佳歌手”和若干“优秀歌手”。
她一生著有长篇小说七部，另有中短篇小说、散文、诗歌、随笔若干。"
HSK7-9,词类,代词,疑问代词,何、怎么着,"历史学家的任务之一是在浩瀚的史料中挖掘出何时、何地发生了何种事件。
这座滨江小城魅力何在？因何引得诸多文人骚客留下脍炙人口的名篇？
他夜里翻来覆去地想着这件事，可是还是不知道该怎么着才好。
你说她半天在那儿一声不吭，是生气了还是怎么着？"
HSK7-9,词类,副词,判断副词,乃,"该片剧情严谨，全员演技在线，真乃一部不可多得的佳作。
我问他是怎么知道的，他神秘地说：“此乃天机，不可泄露。”"
HSK7-9,词类,副词,否定副词,不见得、绝不、无从、无须、无可、勿,"文学上的分类只反映文学作品的特点而非价值的高低，通俗小说不见得不高雅，
不见得不严肃，而那些所谓的非通俗小说，也并非都是精品。
这件事非常麻烦，你就是让比我厉害十倍的人去办，也不见得能办成。
年轻人绝不应为了攀比和享乐而过度消费，甚至背上难以偿还的债务。
他那么聪明的人，绝不会干这种傻事。
即将告别学生时代，我心有千言反而无从说起。
此次会议内容严格保密，外界对其无从得知。
她满墙贴的都是舞台上演奏的照片，音乐对她的重要性无须多言。
“往者不可谏，来者犹可追”，无须为过去的失误而懊悔，重要的是把握现在，展望未来。
她的演唱技巧卓越且感情真挚，让台下评委们无可指摘。
当被问及该片是否以悲剧结尾，女主表示已签署保密协议，对此无可奉告。
女儿春节在外未能回家，询问父母近况，二老回复说：“一切平安，勿念。”
室内若发生煤气泄漏，应立即打开门窗通风，切勿使用明火。"
HSK7-9,词类,副词,方式副词,按理、按说、百般、不由得、趁机、趁早、大肆、断然、公然、火速、截然、竭力、尽情、就近、刻意、拼命、强行、任意、日趋、如期、擅自、私自、特此、瞎、一并、一举、一手、毅然、有意、照常、照例、照样、执意、骤然、逐一、专程,"按理，一到广州我就应该即刻去拜访先生，不料因行程繁忙到最后也未能成行。
你出现了这个失误，按理该扣一个月的工资，但看在你平时工作还算认真的份上，公司决定给你机会将功补过。
按说，以方平的能力完全可以在大城市里立足，可他为了方便照顾父母，毅然选
择回乡工作。年轻人的私事，按说我不该多问，可是既然影响到了工作，我就不能不问一问了。 养护工人对园内种植的一草一木百般呵护，定时浇水、悉心修剪。
这部作品经过了作者的反复斟酌、百般打磨，一经发表便好评如潮。
看见前面登场的选手纷纷取得了较高的得分，即将表演的白兰不由得紧张了起来。
看到新戏排练终于有了进展，导演不由得松了口气。
对方球员心情焦躁，失误明显增多，黑龙江队趁机将比分反超。
全套课程系统讲授了深度学习的常用算法，并非无良商家在人工智能风口趁机推出的“割韭菜”产品。
8号球员好像不在状态，刚才又受了伤，趁早把他换下来，以免影响比赛结果。
你想靠炒股票赚钱？趁早打消这个念头儿吧，你别听人忽悠，炒股的人没有几个赚钱的。
他在饭桌上大肆吹嘘自己的财富和人脉，试图建立起一个成功人士的形象。
夏季是害虫大肆为害的时节，为保障群众身心健康，服务团队对重点区域进行了
全方位的科学消杀。
对于贵方提出的无理要求，我方断然拒绝。
举办一场国际展览会，断然不可能仅凭一己之力完成，需各方精诚合作、共同努力。
被告公然违反法律规定，散布谣言，严重损害了原告的商业信誉。
他在训练时公然顶撞主教练，受到严肃批评是理所当然的。
地震发生后，他主动终止休假，火速归队，毅然投身抢险救灾第一线。
高速公路上一辆大货车轮胎起火亟需救援，高速交警接警后，火速派附近警力和
119消防车前往现场救援。
他们俩虽是双胞胎，性格却截然相反。
供给和需求好比一枚硬币的两面，无法截然分开。
匠人们非常注重技法的精湛，竭力使自己的作品成为流传千古的艺术精品。
但凡旅客有需求，小到一针一线，大到轮椅担架，铁路工作人员都会竭力满足。
游客们迫不及待地躺在草地上尽情呼吸新鲜的空气，享受灿烂的阳光。
在壬寅虎年来临之际，各地人民以丰富多彩的活动，尽情表达了他们的喜悦之情和对新一年的美好憧憬。
所谓“就近入学”，一般是按照户口所在地去附近的学校登记入学。
过去驾驶证补换需前往车管所办理，现在在网上提交信息后即可就近领取。
他在演讲中幽默的插话并非一时兴起，而是刻意为之，以赢得观众的好感。
研究者在选择研究课题时，不能刻意去赶时髦，盲目跟风，而应结合自己的知识结构和研究兴趣。
你别这么拼命地工作，要注意身体啊！
现场所有的粉丝们都在拼命鼓掌、尖叫，气氛热烈极了！
当电梯关门时，不可强行挤入，以免发生危险。
不要直接使用电源开关键强行关机，这样易造成系统文件损坏或丢失。
理发师的手艺高超，顾客可从色板上任意挑选造型，也可带图或口头描述，只有你想不到，没有她做不到。
历史就是历史，谁都不能任意修改。
两宋时期，海外贸易得到了空前发展，海商队伍不断壮大，侨居外商也日趋增多。
智能手机市场现已日趋饱和，如何稳中求变，成了各大厂商首要解决的问题。
虽然时间紧迫，工作量浩繁，工人们终于克服种种困难，如期完成了任务。
为确保活动如期举行，主办方积极协调各方资源，及时解决潜在问题。
为避免员工擅自离职给公司带来麻烦和损失，用人单位可在劳动合同中提前注明相关条款。
未经商标注册人许可，任何组织和个人均不得擅自将该商标用于同类商品上。
行程中请务必听从导游安排，如私自离团，产生的一切后果均须自行承担。
文物购销统一由文物部门负责，国内外人士不得私自进行买卖。
贵公司为我们提供了极大的帮助，特此表示感谢。
与会人员往返旅费自理，会议期间食宿由主办方承担。特此通知。
不明白的不要瞎做，不该说的不要瞎说。
努力先要找准方向，否则累得半死却只是原地打转，瞎忙一通。
为了给山区的孩子们更多的帮助，志愿者回信时还一并寄去了衣服和图书。
关心支持我的朋友太多，无法一一列举，在此一并致谢。
新技术的引入，一举解决了公司长期以来成本过高、产能不足等多项难题。
在奥运会乒乓球男子团体决赛中，三名中国选手团结一致，一举夺冠。
有些家庭条件好的孩子之所以会养成一些不良习惯，完全是父母一手造成的。
为了照顾生病的妻子和年幼的孩子，他关了自己一手创办的工作室，专心守着家人。
山区孩子对知识的渴求深深打动了他，他毅然决定扎根于此，帮助孩子们圆梦大学。
他取得博士学位后，毅然放弃了国外良好的工作条件和优厚的物质待遇，回到了祖国的怀抱。
说到精彩之处，他有意不往下讲，吊足了大家的胃口。
我但凡提出一点儿想法，他就急于反驳，似乎有意跟我过不去。
尽管一周以来连续阴雨，但施工仍照常进行。
虽然她已小有名气，但仍照常在剧场认真演出，打磨演技。
这周末店里的生意比较忙，老郭没有照例休假，而是到店帮忙接待顾客。
新品宣发照例应由市场营销部负责，然而因时间紧迫，其他部门也参与了策划。
他年近80照样身板硬朗，精力和体力不输年轻人。
叶老师并未计较我之前的顶撞，照样对我倾囊相授。
我和他多年未见，本想留他多住几天，可他执意不肯，说是家中有事。
她不顾家人、朋友的劝说，病还没好就执意回到工作岗位。
一夜狂风暴雨过后，气温骤然下降了十几度。
鱼相继在水中跃起，原本平静的湖面，骤然起了波澜。
大幕拉开，节目主持人走上舞台，他首先感谢了观众的到来，然后逐一介绍在场嘉宾。
考生入场后对号入座，将准考证和有效身份证件放在桌子右上角，以备监考员逐一核查。
为了吃到最鲜美的河豚，远在新疆的刘先生跨越三千多公里专程来到扬中。
有一年，我专程去南京拜访了恩师，导师已年逾古稀，但依然精神矍铄。"
HSK7-9,词类,副词,时间副词,姑且、即、即时、届时、尽早、就此、历来、尚、随即、向来、一经、暂且、早日,"出于保护当事人的考虑，我们隐去了其真实姓名，姑且以“张某”代称。
我给您简单分析一下吧，您姑且一听，要是不对，权当我没说。
“蜜月游”愈发流行，不少年轻人办完酒席即启程旅行。
在4G峰值速度下，下载一部1GB大小的高清电影需要1分钟左右，而在5G条件下只需几秒即可。
气象局在暴雨来临前，通过网络、电视、广播等多种媒介，即时发布有关暴雨的预警信号。
在智慧课堂中，李老师通过平板电脑向学生发布任务，根据平台精准反馈的学情
即时进行教学调整。
本协议在履行过程中，如若发生未曾约定的情况，届时由双方共同友好商定。
大会将于9月10日至18日在北京举行，届时将会有近800名国外代表与会。
家长应尽早让孩子参与家务劳动，培养他们的责任感和自理能力。
外出旅行应提前确定行程并尽早预约购票，以防票量不足或票价上涨。
相聚的时光总是短暂的，丰盛的晚餐过后大家就此告别。
虽然油气勘探工作屡遭失败，但是地质学家们并未就此止步，反倒越挫越勇。
“绿肥红瘦”四字是李清照《如梦令》一词的点睛之笔，历来为世人所称道。
苏州历来是经济富饶的鱼米之乡，与杭州齐名，并称“苏杭”。
当时我年纪尚幼，许多事情已然模糊不清，但故乡染满绿的庭院，是记忆深处永远的乡愁。
截至目前，搜救工作尚未发现幸存人员，事故原因尚待调查。
她犹豫了一下，随即拿起了电话，把这件事报告给总经理。
我听闻临近扬州的泰州，早茶亦颇有特色，随即驱车从扬州前往泰州。
孙老板向来一言九鼎，因此在商界信誉很高。
他深居简出，向来不喜与外界交往。
绿色农场种植出的果蔬天然无公害，一经上市便供不应求。
《红楼梦》这部经典名著又要翻拍的消息一经发布，即引起社会热议。
鉴于此问题情况复杂、涉及面广，本文限于篇幅，暂且不做讨论。
任务推进遇到瓶颈时，不妨暂且搁置细节问题，集中精力解决主要问题。
我们期待她的新作早日问世，并且预祝她在文学创作上取得更大的成功。
孩子们自发来到病房里看望老师，感谢老师的辛勤付出并祝愿老师早日康复。"
HSK7-9,词类,副词,程度副词,大为、分外、何等、极度、极力、略、略微、颇、稍稍、万分、微、尤为、愈加、越发,"当他们第一次品尝这道精致的菜肴时，大为惊叹，味蕾感到前所未有的满足。
该歌手的演唱会门票，每张均以高价售出，但其表演水平并不高，观众看后大为不满。
与高手过招时须分外小心，万不可轻举妄动。
由于周边建筑都比较低矮，这座大楼显得分外高大。
拥有一双发现美的眼睛，在平淡生活中捕捉到一点一滴的美好，是何等幸运！
在地形条件复杂的地区修筑一条长距离的铁路，不仅需攻克技术难题，而且投资
巨大、耗时耗力，是何等地不容易啊！
即使在极度困难的条件下，他仍执着地追求着自己的艺术理想。
他这段时间一直极度紧张和焦虑，现在终于放松下来了。
在会议上，他提出的解决方案大家都表示赞成，只有副总经理一个人极力反对。
他极力想忍住，但疼痛还是使他叫出声来。
今年这套试卷注重考查学生灵活运用语言知识的能力，整体难度略高于历年考题。
主人的审美意趣如何，从其所着的衣饰和家中的陈设，便可略知一二。
他脸上挂着浅浅笑意，听到问题后总会先略微思考一下，再不紧不慢地作答。
志愿者的热情如融融阳光，为这略微有些寒冷的清晨带来了暖意。
林青自幼对木雕颇感兴趣，六岁起即拜当地的匠人为师，潜心学习雕刻技艺。
城市民宿往往隐于闹市，因其风格独特，活动自由，如今颇受顾客青睐。
他顾不上长途飞行的疲惫，稍稍歇息后就马不停蹄地与客户商讨合作事宜。
她坐在那里，低头摆弄着衣角，稍稍有些拘谨。
按照赵医生的手术治疗方案，患者最后转危为安，家属对其万分感激。
学生们平时只在银幕上见过周老师，现在有幸现场得见其“庐山真面目”，个个激动万分。
谈及自己的远大理想，他有点儿激动，面色微红，声音也有点儿颤抖。
听了我的话，他微张着嘴，好像想说点儿什么，但最终还是什么也没说。
这次比赛中，9号选手的表现尤为突出，给评委和观众都留下了深刻的印象。
在三星堆考古新成果中，尤为引人注目的是一座通高近70厘米的大口尊。
近年来，两国战略沟通合作日益密切，兄弟情谊愈加深厚。
随着阅读的增多，书慧愈加不满足于安居于室，渴望去见识外面的世界。
经过数百次的舞台历练，他的演技越发纯熟。
缠绵的雨丝，飘洒在青石小巷，越发让人觉得诗意。"
HSK7-9,词类,副词,范围副词,大体、概、皆、尽、均、通通、统统、唯、唯独、唯有、无非、一概,"他的身体已经大体恢复了，我觉得可以进行一些基础性训练了。
同类企业中，设备或许大体相似，但是生产效能可能相差悬殊。
游客因擅自参加高危活动所造成的人身和财产损失，本旅行社概不负责。
凡成大事者，必定有坚韧不拔的意志。古今中外，概莫能外。
这部剧除男女主角之外，其他演员皆一人分饰数角，但每个人物特点鲜明，并不会让观众混淆。
中国瓷器之所以享誉世界，皆因其实用与审美并存。
荆门为荆楚文化发祥地之一，文化底蕴深厚，历史古迹遍地皆是。
从广州塔顶楼俯瞰，羊城璀璨的夜景尽收眼底。
村落被青山绿水环绕，尽是些古朴的瓦房和雅致的石桥，没有丝毫现代化的气息，却添了几分宁静与幽然。
在有关部门的大力监管下，存在环境安全隐患的酒店、餐厅等均已完成整改。
市场上某些特殊商品不宜标价的，均须经当地价格主管部门核准。
那一大堆坏了的电器，他只用了一个晚上的时间，就通通修理好了。
这些事情你通通不要管，你只负责技术革新。
她对年轻后辈毫无保留，将自己多年来的经验教训统统分享给了大家。
他现在是一切为了孩子，什么升职发财换大房子，他统统不去想了。
现在很多孩子都有“唯我为大”的思维方式，这跟父母的过分溺爱有密切的关系。
修身之道不唯阅读，品茶、闲谈、对弈、抚琴、练武、游历山水均可养性。
那么多同他一起备考的考生都放弃了，唯独他一个人坚持了下来。
人的眼睛，能洞察他人，观测周遭的事物，唯独无法窥见自己的真容。
我们村上了岁数的老人几乎都不会用智能手机，唯有老村长是个例外。
在全球化的激烈竞争中，唯有持续创新才能立于不败之地。
综合来看，外语学习的动机无非两种：融合型动机和工具型动机。
邻居跟我偶然碰见时会闲聊几句，说的无非是些家长里短的事情。
国务院明确规定，我国的“驰名商标”工作一概由国家商标局负责。
小夫妻俩决定婚礼一切从简，只摆几桌酒席，婚车和接亲环节一概取消。"
